{
  "schema_version": "1.0",
  "catalog_id": "shangyu_system_modules_v1",
  "design_principles": [
    "固定模板优先；只有公司已登记且没有可用固定流程时，才进入通用兜底。",
    "公司识别、商品映射、店铺、物流、单号和输出分别只有一个权威模块。",
    "转换模块只输出管易Excel、上传预检manifest和摘要；浏览器模块不读取原始订单或判断业务规则。",
    "缺少必要事实时停止并集中追问；能安全形成预览的决定放在结果小节确认。",
    "历史兼容实现必须单独登记为legacy，不能伪装成新订单活动实现。"
  ],
  "modules": [
    {
      "module_id": "source_intake",
      "title": "输入识别与字段完整性",
      "responsibility": "接收已知Excel、未知Excel、文字和截图草稿，并校验收件、商品、数量等必要字段。",
      "boundary": "不决定公司业务规则、店铺或商品目标SKU。",
      "authority_paths": ["src/auto_shipped/services/text_intake.py", "src/auto_shipped/source_adapters"],
      "dependencies": [],
      "implementation_refs": ["source.recipient.required_fields"],
      "policy_module_ids": [],
      "status": "active"
    },
    {
      "module_id": "company_workflow_routing",
      "title": "公司、固定流程与通用兜底路由",
      "responsibility": "解析公司身份，先选择固定流程，无固定流程时仅对fallback_enabled公司选择共享兜底。",
      "boundary": "不解析商品、不分配店铺、不上传管易。",
      "authority_paths": ["config/companies/company_registry_v1.json", "config/routing/order_routes_v1.json", "src/auto_shipped/companies/registry.py", "src/auto_shipped/routing/registry.py"],
      "dependencies": ["source_intake"],
      "implementation_refs": [],
      "policy_module_ids": [],
      "status": "active"
    },
    {
      "module_id": "adaptive_excel",
      "title": "未知Excel自适应解析",
      "responsibility": "只读探测表头和结构，形成字段映射计划，并只对无法确定的必要字段追问。",
      "boundary": "不得凭文件外观猜公司；不得绕过公司与工作流路由。",
      "authority_paths": ["src/auto_shipped/services/adaptive.py", "src/auto_shipped/source_adapters/adaptive_excel.py", "contracts/adaptive_source_plan.schema.json"],
      "dependencies": ["company_workflow_routing"],
      "implementation_refs": [],
      "policy_module_ids": [],
      "status": "active"
    },
    {
      "module_id": "product_resolution",
      "title": "商品目录、映射与组合展开",
      "responsibility": "按编码、条码、正式映射、规范名称和候选优先级解析管易商品及规格，并展开已确认组合商品。",
      "boundary": "低可信相似名称只能给候选；不得自行创造商品代码。",
      "authority_paths": ["src/auto_shipped/catalog", "config/catalog/external_sku_mappings.json", "config/catalog/package_semantics_v1.json"],
      "dependencies": ["source_intake"],
      "implementation_refs": ["guanyi.product_catalog.confirmed_exact", "guanyi.item_expansion.confirmed_source_components"],
      "policy_module_ids": [],
      "status": "active"
    },
    {
      "module_id": "mapping_governance",
      "title": "正式、待确认与本批临时映射治理",
      "responsibility": "同步飞书正式映射，保存本批替换，串行新增用户确认的长期映射并校验冲突。",
      "boundary": "本批临时替换不得伪装成正式映射；已有映射的替换必须走管理员治理。",
      "authority_paths": ["src/auto_shipped/integrations/feishu", "contracts/official_product_mapping.schema.json", "contracts/current_batch_mapping_replacement.schema.json"],
      "dependencies": ["product_resolution", "feishu_integration"],
      "implementation_refs": [],
      "policy_module_ids": [],
      "status": "active"
    },
    {
      "module_id": "store_assignment",
      "title": "店铺分配",
      "responsibility": "按固定店铺、来源渠道、SKU关联或受控商品兜底分配唯一店铺。",
      "boundary": "同单命中多个店铺或没有已确认规则时停止；通用兜底按company_id隔离店铺事实，共享来源配置不能造成跨公司污染，玉米兜底不影响自营天猫京东等固定流程。",
      "authority_paths": ["src/auto_shipped/platforms/guanyi/store_assignment.py", "config/platform_rules/guanyi/policy_modules_v1.json"],
      "dependencies": ["product_resolution", "company_workflow_routing"],
      "implementation_refs": ["guanyi.store_assignment.fixed", "guanyi.store_assignment.by_product", "guanyi.store_assignment.by_source_channel", "guanyi.store_assignment.by_manual_route", "guanyi.store_assignment.by_manual_route_then_product"],
      "policy_module_ids": ["store.corn_to_guangming_manyuanqi.v1", "store.taojuzi_manual_channels.v1", "store.sam_fixed.v1", "store.manual_linked_routes.v1", "store.generic_company_manual_fallback.v1"],
      "status": "active"
    },
    {
      "module_id": "order_identity",
      "title": "平台单号与中央日序号",
      "responsibility": "执行订单编号优先、来源单号次之、最后才按已登记前缀和飞书中央日序号生成。",
      "boundary": "不同前缀分别计数；同一来源重跑复用原号段；不得临时猜测前缀。",
      "authority_paths": ["src/auto_shipped/services/order_number_allocations.py", "src/auto_shipped/integrations/feishu/daily_sequence_ledger.py", "src/auto_shipped/platforms/guanyi/custom_import.py"],
      "dependencies": ["company_workflow_routing", "feishu_integration"],
      "implementation_refs": ["guanyi.platform_order.preferred_order_identity", "guanyi.platform_order.affixed_preferred_order_identity", "guanyi.platform_order.prefix_daily_sequence"],
      "legacy_implementation_refs": ["guanyi.platform_order.prefix_minute_sequence"],
      "policy_module_ids": [],
      "status": "active"
    },
    {
      "module_id": "order_business_policies",
      "title": "会员、金额、物流、备注与默认值",
      "responsibility": "集中执行买家会员、价格金额、仓库、支付、订单类型、物流、联系方式后缀、白标和备注分流。",
      "boundary": "共享默认值只定义一次；公司差异通过规则包引用或显式覆盖。",
      "authority_paths": ["src/auto_shipped/platforms/guanyi/order_policies.py", "src/auto_shipped/platforms/guanyi/custom_import.py", "config/platform_rules/guanyi/policy_modules_v1.json", "config/catalog/white_label_skus_v1.json"],
      "dependencies": ["product_resolution", "store_assignment"],
      "implementation_refs": ["guanyi.buyer_member.policy", "guanyi.buyer_member.sam_pattern", "guanyi.contact_suffix.jd_zhongtong_recipient_marker", "guanyi.defaults.order_flags", "guanyi.defaults.order_type", "guanyi.defaults.payment_method", "guanyi.defaults.warehouse_name", "guanyi.defaults.zero_amounts", "guanyi.logistics.corn_packaging_policy", "guanyi.logistics.default_yunda", "guanyi.note_routing.courier_instruction_to_address", "guanyi.seller_remark.rule_composition", "guanyi.seller_remark.white_label_sku_library"],
      "policy_module_ids": ["buyer.normal_zhang.v1", "defaults.standard_sales.v1", "logistics.source_override_then_corn_packaging.v1", "logistics.source_override_then_default_yunda.v1", "note.courier_instruction_to_address.v1", "remark.source_then_system.v1"],
      "status": "active"
    },
    {
      "module_id": "conversion_delivery",
      "title": "管易Excel、manifest与摘要交付",
      "responsibility": "合并生成管易导入Excel、上传预检manifest和脱敏/决策摘要。",
      "boundary": "生成文件不代表获得上传授权；不读取浏览器页面状态。",
      "authority_paths": ["src/auto_shipped/services/convert.py", "src/auto_shipped/services/batch_convert.py", "src/auto_shipped/platforms/guanyi/preflight.py", "contracts/upload_batch.schema.json"],
      "dependencies": ["order_business_policies", "order_identity"],
      "implementation_refs": [],
      "policy_module_ids": [],
      "status": "active"
    },
    {
      "module_id": "feishu_integration",
      "title": "飞书CLI统一网关",
      "responsibility": "统一身份探测、表格读写、映射同步、中央序号和错误分类。",
      "boundary": "业务模块不得各自拼接不兼容的lark-cli身份探针或直接并发写同一revision表。",
      "authority_paths": ["src/auto_shipped/integrations/feishu/lark_cli_gateway.py", "config/integrations/feishu_mapping_governance_v1.json", "config/integrations/feishu_daily_sequence_v1.json"],
      "dependencies": [],
      "implementation_refs": [],
      "policy_module_ids": [],
      "status": "active"
    },
    {
      "module_id": "browser_upload",
      "title": "管易受控浏览器上传",
      "responsibility": "在用户明确指定批次并授权后选择已确认Excel、填写导入表单并提交。",
      "boundary": "不读取原始订单，不判断公司、商品、店铺或物流；不得把GitHub推送当作上传授权。",
      "authority_paths": ["browser/guanyi/navigation.mjs", "browser/guanyi/submission.mjs", "browser/guanyi/operation-state.mjs"],
      "dependencies": ["conversion_delivery"],
      "implementation_refs": ["browser.guanyi.prepare_import_form.pending_review", "browser.guanyi.import_options.verified_current_ui", "browser.guanyi.submit_import.guarded"],
      "policy_module_ids": [],
      "status": "active"
    },
    {
      "module_id": "post_upload_reconciliation",
      "title": "上传后任务核验",
      "responsibility": "使用唯一新增任务核验指定批次的管易导入结果。",
      "boundary": "不自动审核、发货、作废或删除订单。",
      "authority_paths": ["browser/guanyi/operation-state.mjs"],
      "dependencies": ["browser_upload"],
      "implementation_refs": ["browser.guanyi.task_reconciliation.unique_verified_id"],
      "policy_module_ids": [],
      "status": "active"
    },
    {
      "module_id": "configuration_governance",
      "title": "Schema、规则覆盖与模块审计",
      "responsibility": "校验配置结构、规则实现注册、模块唯一归属、依赖环、弃用污染和运行时打包完整性。",
      "boundary": "治理目录只引用权威配置，不复制可执行业务值。",
      "authority_paths": ["config/governance/system_module_catalog_v1.json", "contracts/system_module_catalog.schema.json", "src/auto_shipped/rules/module_catalog.py", "scripts/audit_modules.py"],
      "dependencies": ["company_workflow_routing", "adaptive_excel", "mapping_governance", "conversion_delivery", "post_upload_reconciliation"],
      "implementation_refs": [],
      "policy_module_ids": [],
      "status": "active"
    }
  ]
}
